<!ELEMENT library (book+)>
<!ELEMENT book (title, author, publication-year)>

<!ELEMENT title (#PCDATA)>
<!ELEMENT author (#PCDATA)>
<!ELEMENT publication-year (#PCDATA)>
